<?xml version="1.0" encoding="UTF-8"?>
<Client xmlns:xsi="http://www.w3.org/2001/XMLSchema-instance"
 xsi:noNamespaceSchemaLocation="http://group17.99k.org/Client.xsd">
    <CompanyName>Beta Tomato Marketing</CompanyName>
    <ClientType>Corporate</ClientType>
    <Discount>2.5</Discount>
    <Street>Lone Castle Road</Street>
    <HouseNo>65</HouseNo>
    <PostCode>W41 BH</PostCode>
	<City>London</City>
</Client>
