<?xml version="1.0" encoding="UTF-8"?>
<Client xmlns:xsi="http://www.w3.org/2001/XMLSchema-instance"
 xsi:noNamespaceSchemaLocation="http://group17.99k.org/Client.xsd">
    <CompanyName>Black Builders Co</CompanyName>
    <ClientType>Private</ClientType>
    <Discount>5</Discount>
    <Street>Bishop Street</Street>
    <HouseNo>66</HouseNo>
    <PostCode>W1A 3WZ</PostCode>
	<City>London</City>
</Client>
