<?xml version="1.0" encoding="UTF-8"?>
<Client xmlns:xsi="http://www.w3.org/2001/XMLSchema-instance"
 xsi:noNamespaceSchemaLocation="http://group17.99k.org/Client.xsd">
    <CompanyName>The Peaceful Zebra Devs</CompanyName>
    <ClientType>Private</ClientType>
    <Discount>6.5</Discount>
    <Street>Emerald Lake Orchard Road</Street>
    <HouseNo>14</HouseNo>
    <PostCode>W11 9AQ</PostCode>
	<City>London</City>
</Client>
